<?xml version="1.0" encoding="UTF-8"?>
<!--
  Copyright (c) 2011  by Cornell University and the Cornell Research
  Foundation, Inc.  All Rights Reserved.

  Permission to use, copy, modify and distribute any part of GobyWeb web
  application for next-generation sequencing data alignment and analysis,
  officially docketed at Cornell as D-5061 ("WORK") and its associated
  copyrights for educational, research and non-profit purposes, without
  fee, and without a written agreement is hereby granted, provided that
  the above copyright notice, this paragraph and the following three
  paragraphs appear in all copies.

  Those desiring to incorporate WORK into commercial products or use WORK
  and its associated copyrights for commercial purposes should contact the
  Cornell Center for Technology Enterprise and Commercialization at
  395 Pine Tree Road, Suite 310, Ithaca, NY 14850;
  email:cctecconnect@cornell.edu; Tel: 607-254-4698;
  FAX: 607-254-5454 for a commercial license.

  IN NO EVENT SHALL THE CORNELL RESEARCH FOUNDATION, INC. AND CORNELL
  UNIVERSITY BE LIABLE TO ANY PARTY FOR DIRECT, INDIRECT, SPECIAL, INCIDENTAL,
  OR CONSEQUENTIAL DAMAGES, INCLUDING LOST PROFITS, ARISING OUT OF THE USE OF
  WORK AND ITS ASSOCIATED COPYRIGHTS, EVEN IF THE CORNELL RESEARCH FOUNDATION,
  INC. AND CORNELL UNIVERSITY MAY HAVE BEEN ADVISED OF THE POSSIBILITY OF SUCH
  DAMAGE.

  THE WORK PROVIDED HEREIN IS ON AN "AS IS" BASIS, AND THE CORNELL RESEARCH
  FOUNDATION, INC. AND CORNELL UNIVERSITY HAVE NO OBLIGATION TO PROVIDE
  MAINTENANCE, SUPPORT, UPDATES, ENHANCEMENTS, OR MODIFICATIONS.  THE CORNELL
  RESEARCH FOUNDATION, INC. AND CORNELL UNIVERSITY MAKE NO REPRESENTATIONS AND
  EXTEND NO WARRANTIES OF ANY KIND, EITHER IMPLIED OR EXPRESS, INCLUDING, BUT
  NOT LIMITED TO, THE IMPLIED WARRANTIES OF MERCHANTABILITY OR FITNESS FOR A
  PARTICULAR PURPOSE, OR THAT THE USE OF WORK AND ITS ASSOCIATED COPYRIGHTS
  WILL NOT INFRINGE ANY PATENT, TRADEMARK OR OTHER RIGHTS.
-->
<xs:schema xmlns:xs="http://www.w3.org/2001/XMLSchema">
    <xs:simpleType name="T_type">
        <xs:restriction base="xs:string">
            <xs:enumeration value="BOOLEAN"/>
            <xs:enumeration value="CATEGORY"/>
            <xs:enumeration value="DOUBLE"/>
            <xs:enumeration value="INTEGER"/>
            <xs:enumeration value="STRING"/>
            <xs:enumeration value="SWITCH"/>
        </xs:restriction>
    </xs:simpleType>
    <xs:simpleType name="T_analysisType">
        <xs:restriction base="xs:string">
            <xs:enumeration value="DiffExp"/>
            <xs:enumeration value="SequenceVariants"/>
            <xs:enumeration value="Methylation"/>
        </xs:restriction>
    </xs:simpleType>
    <xs:complexType name="T_resourceConfig">
        <xs:all>
            <xs:element ref="id"/>
            <xs:element ref="name"/>
            <xs:element ref="version"/>
            <xs:element ref="requires" minOccurs="0"/>
            <xs:element ref="help"/>
            <xs:element ref="files" minOccurs="0" maxOccurs="1"/>
        </xs:all>
    </xs:complexType>
    <xs:complexType name="T_resource">
        <xs:sequence>
            <xs:element ref="id"/>
            <xs:choice minOccurs="1" maxOccurs="1">
                <xs:element ref="versionAtLeast"/>
                <xs:element ref="versionExactly"/>
            </xs:choice>
        </xs:sequence>
    </xs:complexType>
    <xs:complexType name="T_requires">
        <xs:sequence>
            <xs:element ref="resource" maxOccurs="unbounded"/>
        </xs:sequence>
    </xs:complexType>
    <xs:complexType name="T_plugin">
        <xs:choice>
            <xs:element ref="alignerConfig"/>
            <xs:element ref="alignmentAnalysisConfig"/>
            <xs:element ref="resourceConfig"/>
        </xs:choice>
    </xs:complexType>
    <xs:complexType name="T_output-schema">
        <xs:sequence>
            <xs:element ref="outputFile" maxOccurs="unbounded"/>
        </xs:sequence>
    </xs:complexType>
    <xs:complexType name="T_options">
        <xs:sequence>
            <xs:element ref="validation" minOccurs="0" maxOccurs="1"/>
            <xs:element ref="option" maxOccurs="unbounded"/>
        </xs:sequence>
    </xs:complexType>
    <xs:complexType name="T_option">
        <xs:all>
            <xs:element ref="id"/>
            <xs:element ref="dbLegacyId" minOccurs="0"/>
            <xs:element ref="name"/>
            <xs:element ref="help"/>
            <xs:element ref="required" minOccurs="0"/>
            <xs:element ref="defaultsTo" minOccurs="0"/>
            <xs:element ref="type"/>
            <xs:element ref="categories" minOccurs="0"/>
            <xs:element ref="autoFormat" minOccurs="0"/>
            <xs:element ref="flagFormat" minOccurs="0"/>
            <xs:element ref="includeSpaces" minOccurs="0"/>
        </xs:all>
        <xs:attribute name="hiddenWhen" type="xs:string"/>
    </xs:complexType>
    <xs:complexType name="T_files">
        <xs:sequence>
            <xs:element ref="file" maxOccurs="unbounded"/>
        </xs:sequence>
    </xs:complexType>
    <xs:complexType name="T_file">
        <xs:all>
            <xs:element ref="id"/>
            <xs:element ref="filename"/>
            <xs:element ref="importFromPlugin" minOccurs="0"/>
            <xs:element ref="isDirectory" minOccurs="0"/>
        </xs:all>
    </xs:complexType>
    <xs:complexType name="T_outputFile">
        <xs:all>
            <xs:element ref="id"/>
            <xs:element ref="name"/>
            <xs:element ref="help"/>
            <xs:element ref="required" minOccurs="0"/>
            <xs:element ref="filename"/>
            <xs:element ref="mimeType"/>
            <xs:element ref="tableName" minOccurs="0"/>
        </xs:all>
    </xs:complexType>
    <xs:complexType name="T_category" mixed="true">
        <xs:sequence minOccurs="0">
            <xs:element ref="id"/>
            <xs:element ref="name"/>
            <xs:element ref="value"/>
            <xs:element ref="help"/>
            <xs:element ref="dbLegacyValue" minOccurs="0"/>
        </xs:sequence>
    </xs:complexType>
    <xs:complexType name="T_categories">
        <xs:sequence>
            <xs:element ref="category" maxOccurs="unbounded"/>
        </xs:sequence>
    </xs:complexType>
    <xs:complexType name="T_alignmentAnalysisConfig">
        <xs:all>
            <xs:element ref="id"/>
            <xs:element ref="dbLegacyId" minOccurs="0"/>
            <xs:element ref="name"/>
            <xs:element ref="version"/>
            <xs:element ref="help"/>
            <xs:element ref="disabled" minOccurs="0"/>
            <xs:element ref="requires" minOccurs="0"/>
            <xs:element ref="minimumNumberOfGroups" minOccurs="1" maxOccurs="1"/>
            <xs:element ref="maximumNumberOfGroups" minOccurs="1" maxOccurs="1"/>
            <xs:element ref="supportsTranscriptAlignments" minOccurs="0"/>
            <xs:element ref="supportsGobyAlignments" minOccurs="0"/>
            <xs:element ref="supportsBAMAlignments" minOccurs="0"/>
            <xs:element ref="copyAlignments" minOccurs="0" maxOccurs="1"/>
            <xs:element ref="copyWeightFiles" minOccurs="0" maxOccurs="1"/>
            <xs:element ref="splitProcessCombine" minOccurs="0"/>
            <xs:element ref="producesVariantCallingFormatOutput" minOccurs="0"/>
            <xs:element ref="producesTabDelimitedOutput" minOccurs="0"/>
            <xs:element ref="files" minOccurs="0"/>
            <xs:element ref="outputSchema" minOccurs="0"/>
            <xs:element ref="runtime" minOccurs="0" maxOccurs="1"/>
            <xs:element ref="execute" minOccurs="0" maxOccurs="1"/>
            <xs:element ref="options" minOccurs="0"/>
            <xs:element ref="analysisType"/>
        </xs:all>
    </xs:complexType>
    <xs:complexType name="T_alignerConfig">
        <xs:all>
            <xs:element ref="id"/>
            <xs:element ref="dbLegacyId" minOccurs="0"/>
            <xs:element ref="name"/>
            <xs:element ref="version"/>
            <xs:element ref="help"/>
            <xs:element ref="disabled" minOccurs="0"/>
            <xs:element ref="requires" minOccurs="0"/>
            <xs:element ref="supportsColorSpace" minOccurs="0"/>
            <xs:element ref="supportsBisulfiteConvertedReads" minOccurs="0"/>
            <xs:element ref="supportsGobyReads" minOccurs="0"/>
            <xs:element ref="supportsGobyAlignments" minOccurs="0"/>
            <xs:element ref="supportsBAMAlignments" minOccurs="0"/>
            <xs:element ref="supportsPairedEndAlignments" minOccurs="0"/>
            <xs:element ref="supportsFastqReads" minOccurs="0"/>
            <xs:element ref="supportsFastaReads" minOccurs="0"/>
            <xs:element ref="indexDirectory" minOccurs="0"/>
            <xs:element ref="runtime" minOccurs="0" maxOccurs="1"/>
            <xs:element ref="execute" minOccurs="0" maxOccurs="1"/>
            <xs:element ref="options" minOccurs="0"/>
            <xs:element ref="files" minOccurs="0" maxOccurs="1"/>
        </xs:all>
    </xs:complexType>
    <xs:complexType name="T_validation">
        <xs:sequence>
            <xs:element ref="rule" minOccurs="1" maxOccurs="unbounded"/>
        </xs:sequence>
    </xs:complexType>

    <xs:complexType name="T_script">
        <xs:all>
        </xs:all>
        <xs:attribute name="filename" type="xs:string"/>
        <xs:attribute name="language" type="T_script_language_type"/>
        <xs:attribute name="phase" type="T_script_phase_type"/>
    </xs:complexType>
    <xs:element name="need" type="T_need"></xs:element>
    <xs:complexType name="T_rule">
        <xs:all>
        </xs:all>
        <xs:attribute name="validWhen" type="xs:string"/>
        <xs:attribute name="error" type="xs:string"/>
    </xs:complexType>
    <xs:complexType name="T_need">
        <xs:all>
        </xs:all>
        <xs:attribute name="scope" type="T_scope">
        </xs:attribute>
        <xs:attribute name="key" type="xs:string"/>
        <xs:attribute name="value" type="xs:string"/>
    </xs:complexType>
    <xs:complexType name="T_runtime">
        <xs:sequence>
            <xs:element ref="need" minOccurs="1" maxOccurs="unbounded"/>
        </xs:sequence>
    </xs:complexType>

    <xs:complexType name="T_execute">
        <xs:sequence>
            <xs:element ref="script" minOccurs="1" maxOccurs="unbounded"/>
        </xs:sequence>
    </xs:complexType>
    <xs:simpleType name="T_scope">
        <xs:restriction base="xs:string">
            <xs:enumeration value="GLOBAL"/>
            <xs:enumeration value="SPLIT_JVM"/>
            <xs:enumeration value="ALIGN"/>
            <xs:enumeration value="ALIGN_JVM"/>
            <xs:enumeration value="PROCESS"/>
            <xs:enumeration value="PROCESS_JVM"/>
            <xs:enumeration value="COMBINE"/>
            <xs:enumeration value="COMBINE_JVM"/>
            <xs:enumeration value="ALIGNMENT_POST_PROCESSING"/>
            <xs:enumeration value="ALIGNMENT_POST_PROCESSING_JVM"/>
        </xs:restriction>
    </xs:simpleType>
    <xs:simpleType name="T_filename">
        <!-- make sure we don't allow spaces of newline in a filename, because IDEA tends to add them reformatting XML
        files, and this breaks the app. -->
        <xs:restriction base="xs:string">
            <xs:pattern value="[^\n\r\t\s]+"/>
        </xs:restriction>
    </xs:simpleType>
    <xs:element name="versionAtLeast" type="xs:string"/>
    <xs:element name="versionExactly" type="xs:string"/>
    <xs:element name="version" type="xs:string"/>
    <xs:element name="type" type="T_type"/>
    <xs:element name="supportsTranscriptAlignments" type="xs:boolean"/>
    <xs:element name="supportsPairedEndAlignments" type="xs:boolean"/>
    <xs:element name="supportsGobyReads" type="xs:boolean"/>
    <xs:element name="supportsGobyAlignments" type="xs:boolean"/>
    <xs:element name="copyAlignments" type="xs:boolean"  default="true"/>
    <xs:element name="copyWeightFiles" type="xs:boolean"  default="true"/>
    <xs:element name="supportsFastqReads" type="xs:boolean"/>
    <xs:element name="supportsFastaReads" type="xs:boolean"/>
    <xs:element name="supportsColorSpace" type="xs:boolean"/>
    <xs:element name="supportsBisulfiteConvertedReads" type="xs:boolean"/>
    <xs:element name="supportsBAMAlignments" type="xs:boolean"/>
    <xs:element name="splitProcessCombine" type="xs:boolean"/>
    <xs:element name="resourceConfig" type="T_resourceConfig"/>
    <xs:element name="resource" type="T_resource"/>
    <xs:element name="requires" type="T_requires"/>
    <xs:element name="required" type="xs:boolean"/>
    <xs:element name="producesVariantCallingFormatOutput" type="xs:boolean"/>
    <xs:element name="producesTabDelimitedOutput" type="xs:boolean"/>
    <xs:element name="plugin" type="T_plugin"/>
    <xs:element name="outputSchema" type="T_output-schema"/>
    <xs:element name="options" type="T_options"/>
    <xs:element name="option" type="T_option"/>
    <xs:element name="name" type="xs:string"/>
    <xs:element name="value" type="xs:string"/>
    <xs:element name="mimeType" type="xs:string"/>
    <xs:element name="tableName" type="xs:string"/>
    <xs:element name="indexDirectory" type="T_filename"/>
    <xs:element name="includeSpaces" type="xs:boolean"/>
    <xs:element name="importFromPlugin" type="xs:string"/>
    <xs:element name="id" type="xs:string"/>
    <xs:element name="help" type="xs:string"/>
    <xs:element name="flagFormat" type="xs:string"/>
    <xs:element name="files" type="T_files"/>
    <xs:element name="file" type="T_file"/>
    <xs:element name="outputFile" type="T_outputFile"/>
    <xs:element name="filename" type="xs:string"/>
    <xs:element name="disabled" type="xs:boolean"/>
    <xs:element name="defaultsTo" type="xs:string"/>
    <xs:element name="dbLegacyId" type="xs:string"/>
    <xs:element name="dbLegacyValue" type="xs:string"/>
    <xs:element name="category" type="T_category"/>
    <xs:element name="categories" type="T_categories"/>
    <xs:element name="autoFormat" type="xs:boolean"/>
    <xs:element name="alignmentAnalysisConfig" type="T_alignmentAnalysisConfig"/>
    <xs:element name="alignerConfig" type="T_alignerConfig"/>
    <xs:element name="minimumNumberOfGroups" type="xs:integer"/>
    <xs:element name="maximumNumberOfGroups" type="xs:integer"/>
    <xs:element name="analysisType" type="T_analysisType"/>
    <xs:element name="hiddenWhen" type="xs:string"/>
    <xs:element name="validation" type="T_validation"/>
    <xs:element name="rule" type="T_rule"/>
    <xs:element name="runtime" type="T_runtime"/>
    <xs:element name="execute" type="T_execute"/>
    <xs:element name="isDirectory" type="T_isDirectory" default="false"/>

    <xs:element name="script" type="T_script"/>
    <xs:simpleType name="T_script_language_type">
        <xs:restriction base="xs:string">
            <xs:enumeration value="groovy"/>
        </xs:restriction>
    </xs:simpleType>

    <xs:simpleType name="T_script_phase_type">
        <xs:restriction base="xs:string">
                    <xs:enumeration value="pre-deployment"/>
                </xs:restriction>
    </xs:simpleType>


    <xs:simpleType name="T_isDirectory">
        <xs:restriction base="xs:boolean"/>
    </xs:simpleType>

</xs:schema>
