<?xml version="1.0" encoding="UTF-8" standalone="yes"?>
<!--
  ~ Copyright (c) 2011-2013  by Cornell University  and the  Cornell Research Foundation,
  ~ Inc. All Rights Reserved.
  ~
  ~ GobyWeb plugins  are released  under the LGPL3 license,  unless  otherwise specified
  ~ by the license of a specific plugin. See the file LGPL3.license in this distribution
  ~ for a copy of the LGPL license.
  ~
  ~ When a plugin is not released under the LGPL3 license,  the comments  at the top  of
  ~ the plugin's config.xml will indicate how that specific plugin is released/licensed.
  -->
<resourceConfig xsi:noNamespaceSchemaLocation="../../../schemas/plugins.xsd"
                 xmlns:xsi="http://www.w3.org/2001/XMLSchema-instance">
    <name>Annotate VCF</name>
    <id>ANNOTATE_VCF</id>
    <help>Annotate VCF files with results from Variant Effect Predictor</help>
    <version>1.1</version>
    <requires>
        <resource>
            <id>VARIANT_EFFECT_PREDICTOR</id>
            <versionAtLeast>2.8</versionAtLeast>
        </resource>
        <resource>
            <id>ENSEMBL_ANNOTATIONS</id>
            <versionAtLeast>1.0</versionAtLeast>
        </resource>
        <resource>
            <id>TABIX</id>
            <versionAtLeast>0.2.6</versionAtLeast>
        </resource>
        <!--resource>
            <id>VCF_TOOLS</id>
            <versionAtLeast>0.1.10</versionAtLeast>
        </resource-->

    </requires>
    <files>
        <file>
            <id>EXEC_PATH</id>
            <filename>annotate_vcf.sh</filename>
        </file>
    </files>

</resourceConfig>
