<?xml version="1.0" encoding="UTF-8" standalone="yes"?>
<!--
  ~ Copyright (c) 2011-2013  by Cornell University  and the  Cornell Research Foundation,
  ~ Inc. All Rights Reserved.
  ~
  ~ GobyWeb plugins  are released  under the LGPL3 license,  unless  otherwise specified
  ~ by the license of a specific plugin. See the file LGPL3.license in this distribution
  ~ for a copy of the LGPL license.
  ~
  ~ When a plugin is not released under the LGPL3 license,  the comments  at the top  of
  ~ the plugin's config.xml will indicate how that specific plugin is released/licensed.
  -->
<alignerConfig xsi:noNamespaceSchemaLocation="../../../schemas/plugins.xsd"
               xmlns:xsi="http://www.w3.org/2001/XMLSchema-instance">
    <name>BWA mem (auto-install)</name>
    <id>BWA_MEM_ARTIFACT</id>
    <help>BWA mem, result converted to Goby format</help>
    <version>1.0.1</version>
    <supportsColorSpace>true</supportsColorSpace>
    <supportsGobyAlignments>true</supportsGobyAlignments>
    <supportsPairedEndAlignments>true</supportsPairedEndAlignments>
    <supportsBAMAlignments>false</supportsBAMAlignments>
    <supportsGobyReads>true</supportsGobyReads>
    <supportsFastqReads>false</supportsFastqReads>
    <supportsFastaReads>false</supportsFastaReads>
    <!-- indexDirectory is no longer used -->
    <indexDirectory>%NODE_LOCAL_DATA_ROOT%/%VERSION%/%ORGANISM%/%SPACE%/bwa</indexDirectory>
    <requires>
        <resource>
            <id>BWA07</id>
            <versionAtLeast>0.7.15.1</versionAtLeast>
        </resource>
        <resource>
            <id>GOBY3</id>
            <versionAtLeast>3.0.3.SNAPSHOT</versionAtLeast>
        </resource>
    </requires>
    <runtime>
        <need scope="ALIGN" key="excl" value="true"/>
        <need scope="ALIGN" key="h_vmem" value="30G"/>
        <need scope="ALIGN" key="virtual_free" value="10G"/>
        <need scope="ALIGN_JVM" value="35G"/>
        <!-- It is not clear why we need so much more memory than the amount given to the JVM (8g as of
        this commit, but some jobs fail when given "only" 3g extra as the SGE limit (11g). -->
        <need scope="ALIGNMENT_POST_PROCESSING" key="excl" value="false"/>
        <need scope="ALIGNMENT_POST_PROCESSING" key="h_vmem" value="15G"/>
        <need scope="ALIGNMENT_POST_PROCESSING" key="virtual_free" value="15G"/>
    </runtime>
    <options>
        <option>
            <id>MEM_OPTIONS</id>
            <name>Options for bwa mem</name>
            <help>Provide any additional options here following the syntax expected by bwa mem.</help>
            <required>false</required>
            <defaultsTo></defaultsTo>
            <type>STRING</type>
            <flagFormat>%s</flagFormat>
            <includeSpaces>true</includeSpaces>
            <autoFormat>false</autoFormat>
        </option>
        <option>
            <id>AMBIGUITY_THRESHOLD</id>
            <dbLegacyId>ambiguityThreshold</dbLegacyId>
            <name>Ambiguity threshold</name>
            <help>The maximum number of reference sequence locations that can be matched for a read to be considered
                non-ambiguous.
            </help>
            <required>true</required>
            <defaultsTo>1</defaultsTo>
            <type>INTEGER</type>
            <autoFormat>true</autoFormat>
            <flagFormat>-n %s</flagFormat>
            <includeSpaces>true</includeSpaces>
        </option>

    </options>
</alignerConfig>
